<?xml version="1.0" encoding="iso-8859-1" standalone="no"?>
<!DOCTYPE report SYSTEM "../dtd/report.dtd">
<report id="46400" pubid="352" publish="true">
	<title>William and Mary, 1693</title>
	<subtitle>Chapter VI. An Act to prevent Disputes and Controversies concerning Royal Mines. [Rot. Parl. pt. 2. nu. 5.]</subtitle>
	<section id="s1">
		<head>Recital of 1 W. &amp; M. Sess. 1. c. 30.</head>
		<para id="p1">
			<emph type="i">Owners of Mines shall enjoy them</emph>.</para>
		<para id="p2">Whereas by a Clause in one Act of Parliament made in the First yeare of their Majesties Reigne entituled
An Act to repeal the Statute made in the Fifth yeare of King Henry the Fourth against the multiplying of
Gold and Silver It is amongst other things enacted that noe Mine of Tin Copper Iron or Lead shall hereafter be
adjudged reputed or taken to bee a Royal Mine although Gold or Silver may be extracted out of the same But
notwithstanding the good provision by the said Statute to prevent the discourageing their Majesties good Subjects
who have Mines of Copper Tin Iron or Lead in their Soyls from digging and opening the same many doubts
and questions have arisen upon the said Statute whereby great suits and troubles have arisen to many owners and
Proprietors of such Mines. Wherefore for the better explanac[i]on of the said Statute Be it enacted and declared by
the King and Queens most Excellent Majesties by and with the advice and consent of the Lords Spiritual and
Temporal and the Co[m]mons in this present Parliament assembled and by the Authority of the same That all and
every Person or Persons being Subjects of the Crowne of England Bodies Politick or Corporate that now are or
hereafter shall be the Owner or Owners Proprietor or Proprietors of any Mine or Mines within the Kingdom of
England Dominion of Wales or Towne of Berwick upon Tweed wherein any Ore now is or hereafter
shall be discovered opened found or wrought and in which there is Copper Tin Iron or Lead shall
and may hold and enjoy the same Mine or Mines and Ore and continue in the possession thereof
and dig and work the said Mine or Mines or Ore notwithstanding that such Mine or Mines or Ore
shall be pretended or claimed to be a Royall Mine or Royall Mines any Law Usage or Custom to the contrary
notwithstanding.</para>
		<section id="s2">
			<head>II. King shall have the Ore at a Rate.</head>
			<para id="p3">
				<emph type="i">Several Rates</emph>.</para>
			<para id="p4">Provided always and be it enacted and declared That their Majesties [ther<ref idref="n2">2</ref>] Heirs and Successors and all claimeing
any Royal Mines under them shall and may have the Ore of any such Mine or Mines in any part of the said
Kingdom of England Dominion of Wales or Towne of Berwick upon Tweed (other then Tin Ore in the Counties
of Devon and Cornwall) paying to the Proprietors or Owners of the said Mine or Mines wherein such Ore is
or shall be found within Thirty days after the said Ore is or shall bee raised and laid upon the Banks of the
said Mine or Mines and before the same be removed from thence the rates following (that is to say) For all
Ore washt made cleane and merchantable wherein is Copper the rate of Sixteen Pounds per Tun and for all Ore
washt made cleane and merchantable wherein there is Tin the rate of Fourty Shillings per Tun and for all Ore
washt made clean and merchantable wherein there is Iron the rate of Fourty Shillings per Tun and for all Ore
washt made cleane and merchantable wherein there is Lead the rate of Nine Pounds per Tun and in default of
payment of such respective sums as aforesaid it shall and may be lawfull for the Owners and Proprietors of the
said Mine or Mines wherein such Ore is are or shall be found to sell and dispose of the said Ore to his and
theire own uses any Law Statute or Custome to the contrary notwithstanding.</para>
		</section>
		<section id="s3">
			<head>III. Proviso for Charters, &amp;c. to Tinners of Devon and Cornwall.</head>
			<para id="p5">Provided always That nothing [conteined<ref idref="n2">2</ref>] in this Act shall alter determine or make void the Charters granted
to the Tinners of Devon and Cornwall by any of the Kings and Queens of this Realme or any of the Liberties
Priveledges or Franchises of the said Tinners or to alter determine or make void the Laws Customs or Constitutions
of the Stanneries of Devon or Cornwall or any of them.</para>
			<note id="n1" number="1">their <emph type="i">O</emph>.</note>
			<note id="n2" number="2">interlined on the Roll.</note>
		</section>
	</section>
</report>


