<?xml version="1.0" encoding="iso-8859-1" standalone="no"?>
<!DOCTYPE report SYSTEM "../dtd/report.dtd">
<report id="47298" pubid="351" publish="true">
	<title>Charles II, 1661</title>
	<subtitle>An Act for Confirming an Act Entituled An Act for encouraging and encreasing of Shipping &amp; Navigation and severall other Acts both publique and private mentioned therein.</subtitle>
	<section id="s1">
		<head>Recital that during the Troubles the Lords and Commons were assembled, and several &bholigct;s were passed of necessary Use.</head>
		<para id="p1">
			<emph type="i">12 Car. II. c. 18.; c.32.; c.36.; c.34.; c.13.; c.6.; 12 Car. II. pr. ante p. 253.; confirmed and declared to have the full force of &bholigct;s of Parliament</emph>.</para>
		<para id="p2">WHEREAS during the late difficulties &amp; exigencies of affaires in the absence of His most Excellent
Majestie and in reference to His return from beyond the Seas into those His Majesties Dominions The
Lords and Commons being assembled att Westminster the five and twentieth day of Aprill in the twelfth yeare
of His Majesties Reigne were from thence and after his Majesties returne continued untill the nine and twentieth
day of December then next following and now last past and then dissolved by his Majestie In which time severall
&bholigct;s were passed by his Majesty by and with the advice &amp; consent of the [said<ref idref="n1">1</ref>] Lords and Commons assembled
as aforesaid which being of necessary use are fitt to be continued and confirmed although the manner of the said
assembling enforced by the difficulties and exigencies aforesaid which then lay upon the Nation is not to bee
into example Bee it therefore En&bholigct;ed by the Kings most Excellent Majesty by and with the advice and
consent of the Lords and Commons in this present Parliament assembled and by the Authority of the same That
all and singuler the &bholigct;s made or men&bhocotil;ned to be made by his said Majesty by and with the advice or [consents<ref idref="n2">2</ref>]
of the Lords and Commons upon or since the said five and twentieth day of Aprill herein after particularly
men&bhocotil;ned and expressed (that is to say) One &bholigct; Entituled An &bholigct; for the encouraging and encreasing of
Shipping and Navigation One other &bholigct; Entituled An &bholigct; for Prohibiting the Exportation of Wool Wool Fells
Fullers Earth or any kind of Scouring Earth One other &bholigct; Entituled An &bholigct; impowring the Master of the Rolls
for the time being to make Leases for yeares in order to new build the old Houses belonging to the Rolls One
other &bholigct; Entituled An &bholigct; for prohibiting the planting setting or sowing of Tobacco in England and Ireland One
other &bholigct; Entituled An &bholigct; for restraining the takeing of excessive Usury One other &bholigct; Entituled An &bholigct; for
the present nominating of Commissioners of Sewers One other &bholigct; Entituled An &bholigct; for the Incorporating of the
Master and Wardens of the Company of Haberdashers London to be Governors of the Free Schoole &amp; Almes
houses in Newport in the County of Salop of the Foundation of William Adams and for setling of Lands and
Possessions on them for maintenance thereof and other charitable uses. And all and every the Clauses Sentences
and Articles in them and every of them contained shall be and [are hereby ratified<ref idref="n3">3</ref>] and confirmed and en&bholigct;ed
and declared to have the full force and strength of &bholigct;s of Parliament according to the tenor and purport thereof
and soe shall be adjudged deemed and taken to all intents and purposes whatsoever and as if the same had beene
made declared and en&bholigct;ed by Authority of this present Parliament.</para>
		<note id="n1" number="1">interlined on the Roll.</note>
		<note id="n2" number="2">Consent <emph type="i">O</emph>.</note>
		<note id="n3" number="3">hereby are <emph type="i">O</emph>.</note>
	</section>
</report>

